[
  {
    "id": "post_001",
    "title": "Mezame Insights 1: Premium Minimalist Art Trends",
    "slug": "insights-1-premium-minimalist-art-trends",
    "excerpt": "A concise look at premium minimalist art trends shaping global markets.",
    "content": "## Overview\nThis post previews trend 1 with market-ready placeholder copy for visualization.",
    "author": "Artist 5",
    "category": "Artist Features",
    "tags": [
      "Concept",
      "Minimalist"
    ],
    "coverImage": "https://picsum.photos/seed/post_001/1600/900",
    "status": "published",
    "publishedAt": "2025-10-02T17:23:41.459982"
  },
  {
    "id": "post_002",
    "title": "Mezame Insights 2: Premium Minimalist Art Trends",
    "slug": "insights-2-premium-minimalist-art-trends",
    "excerpt": "A concise look at premium minimalist art trends shaping global markets.",
    "content": "## Overview\nThis post previews trend 2 with market-ready placeholder copy for visualization.",
    "author": "Artist 4",
    "category": "Artist Features",
    "tags": [
      "Geometric",
      "Portrait"
    ],
    "coverImage": "https://picsum.photos/seed/post_002/1600/900",
    "status": "published",
    "publishedAt": "2025-10-02T17:23:41.460004"
  },
  {
    "id": "post_003",
    "title": "Mezame Insights 3: Premium Minimalist Art Trends",
    "slug": "insights-3-premium-minimalist-art-trends",
    "excerpt": "A concise look at premium minimalist art trends shaping global markets.",
    "content": "## Overview\nThis post previews trend 3 with market-ready placeholder copy for visualization.",
    "author": "Artist 7",
    "category": "Insights",
    "tags": [
      "Surreal",
      "Portrait"
    ],
    "coverImage": "https://picsum.photos/seed/post_003/1600/900",
    "status": "published",
    "publishedAt": "2025-10-02T17:23:41.460014"
  },
  {
    "id": "post_004",
    "title": "Mezame Insights 4: Premium Minimalist Art Trends",
    "slug": "insights-4-premium-minimalist-art-trends",
    "excerpt": "A concise look at premium minimalist art trends shaping global markets.",
    "content": "## Overview\nThis post previews trend 4 with market-ready placeholder copy for visualization.",
    "author": "Artist 3",
    "category": "Artist Features",
    "tags": [
      "Monochrome",
      "Minimalist"
    ],
    "coverImage": "https://picsum.photos/seed/post_004/1600/900",
    "status": "published",
    "publishedAt": "2025-10-02T17:23:41.460025"
  },
  {
    "id": "post_005",
    "title": "Mezame Insights 5: Premium Minimalist Art Trends",
    "slug": "insights-5-premium-minimalist-art-trends",
    "excerpt": "A concise look at premium minimalist art trends shaping global markets.",
    "content": "## Overview\nThis post previews trend 5 with market-ready placeholder copy for visualization.",
    "author": "Artist 1",
    "category": "Trends",
    "tags": [
      "Landscape",
      "Geometric"
    ],
    "coverImage": "https://picsum.photos/seed/post_005/1600/900",
    "status": "published",
    "publishedAt": "2025-10-02T17:23:41.460036"
  },
  {
    "id": "post_006",
    "title": "Mezame Insights 6: Premium Minimalist Art Trends",
    "slug": "insights-6-premium-minimalist-art-trends",
    "excerpt": "A concise look at premium minimalist art trends shaping global markets.",
    "content": "## Overview\nThis post previews trend 6 with market-ready placeholder copy for visualization.",
    "author": "Artist 8",
    "category": "Insights",
    "tags": [
      "Concept",
      "Landscape"
    ],
    "coverImage": "https://picsum.photos/seed/post_006/1600/900",
    "status": "published",
    "publishedAt": "2025-10-02T17:23:41.460047"
  },
  {
    "id": "post_007",
    "title": "Mezame Insights 7: Premium Minimalist Art Trends",
    "slug": "insights-7-premium-minimalist-art-trends",
    "excerpt": "A concise look at premium minimalist art trends shaping global markets.",
    "content": "## Overview\nThis post previews trend 7 with market-ready placeholder copy for visualization.",
    "author": "Artist 7",
    "category": "Artist Features",
    "tags": [
      "Surreal",
      "Geometric"
    ],
    "coverImage": "https://picsum.photos/seed/post_007/1600/900",
    "status": "published",
    "publishedAt": "2025-10-02T17:23:41.460058"
  },
  {
    "id": "post_008",
    "title": "Mezame Insights 8: Premium Minimalist Art Trends",
    "slug": "insights-8-premium-minimalist-art-trends",
    "excerpt": "A concise look at premium minimalist art trends shaping global markets.",
    "content": "## Overview\nThis post previews trend 8 with market-ready placeholder copy for visualization.",
    "author": "Artist 8",
    "category": "Market Analysis",
    "tags": [
      "Minimalist",
      "Abstract"
    ],
    "coverImage": "https://picsum.photos/seed/post_008/1600/900",
    "status": "published",
    "publishedAt": "2025-10-02T17:23:41.460070"
  },
  {
    "id": "post_009",
    "title": "Mezame Insights 9: Premium Minimalist Art Trends",
    "slug": "insights-9-premium-minimalist-art-trends",
    "excerpt": "A concise look at premium minimalist art trends shaping global markets.",
    "content": "## Overview\nThis post previews trend 9 with market-ready placeholder copy for visualization.",
    "author": "Artist 7",
    "category": "Artist Features",
    "tags": [
      "Geometric",
      "Landscape"
    ],
    "coverImage": "https://picsum.photos/seed/post_009/1600/900",
    "status": "published",
    "publishedAt": "2025-10-02T17:23:41.460081"
  },
  {
    "id": "post_010",
    "title": "Mezame Insights 10: Premium Minimalist Art Trends",
    "slug": "insights-10-premium-minimalist-art-trends",
    "excerpt": "A concise look at premium minimalist art trends shaping global markets.",
    "content": "## Overview\nThis post previews trend 10 with market-ready placeholder copy for visualization.",
    "author": "Artist 1",
    "category": "Insights",
    "tags": [
      "Portrait",
      "Abstract"
    ],
    "coverImage": "https://picsum.photos/seed/post_010/1600/900",
    "status": "published",
    "publishedAt": "2025-10-02T17:23:41.460091"
  },
  {
    "id": "post_011",
    "title": "Mezame Insights 11: Premium Minimalist Art Trends",
    "slug": "insights-11-premium-minimalist-art-trends",
    "excerpt": "A concise look at premium minimalist art trends shaping global markets.",
    "content": "## Overview\nThis post previews trend 11 with market-ready placeholder copy for visualization.",
    "author": "Artist 5",
    "category": "Insights",
    "tags": [
      "Monochrome",
      "Concept"
    ],
    "coverImage": "https://picsum.photos/seed/post_011/1600/900",
    "status": "published",
    "publishedAt": "2025-10-02T17:23:41.460102"
  },
  {
    "id": "post_012",
    "title": "Mezame Insights 12: Premium Minimalist Art Trends",
    "slug": "insights-12-premium-minimalist-art-trends",
    "excerpt": "A concise look at premium minimalist art trends shaping global markets.",
    "content": "## Overview\nThis post previews trend 12 with market-ready placeholder copy for visualization.",
    "author": "Artist 9",
    "category": "Market Analysis",
    "tags": [
      "Landscape",
      "Monochrome"
    ],
    "coverImage": "https://picsum.photos/seed/post_012/1600/900",
    "status": "published",
    "publishedAt": "2025-10-02T17:23:41.460110"
  }
]